Name,Handle,Timestamp,Verified,Content,Comments,Retweets,Likes,Analytics,Tags,Mentions,Emojis,Profile Image,Tweet Link,Tweet ID
Sierra Club,@SierraClub,2017-08-30T18:22:03.000Z,True,"""A food bank can get more for $1 than others can at a grocery store...Donating money is more useful than food"" http://sc.org/2iGvuxV",0,35,34,0,[],[],[],https://pbs.twimg.com/profile_images/1837476384689606656/HVB6Qc8t_normal.png,https://x.com/SierraClub/status/902959616983740423,tweet_id:902959616983740423
Galaxy Digital,@GalaxyDigital,2017-08-30T18:19:44.000Z,False,"Comments like these make our day!  Thank you, @_ADFields https://x.com/_ADFields/status/902950536789594112…",0,0,0,0,[],[],"['\\U0001f60a', '\\U0001f64c\\U0001f3fd']",https://pbs.twimg.com/profile_images/1037802927430283264/Yxadwzsm_normal.jpg,https://x.com/GalaxyDigital/status/902959035816783876,tweet_id:902959035816783876
OneEach Technologies,@OneEach,2017-08-29T19:58:28.000Z,False,"Allyson James is getting ready to make her ""More Than a Website"" presentation at the 2017  Conference & Expo!",0,1,0,0,[],['@mealsonwheels'],[],https://pbs.twimg.com/profile_images/1429133834176454657/MkPhV7Z__normal.jpg,https://x.com/OneEach/status/902621495037485056,tweet_id:902621495037485056
Galaxy Digital,@GalaxyDigital,2017-08-29T14:24:27.000Z,False,Learn why Photovoice can be a more ethical mode of #ServiceLearning. Shared at @OHCampusCompact earlier this month,0,1,0,0,['#ServiceLearning'],[],[],https://pbs.twimg.com/profile_images/1037802927430283264/Yxadwzsm_normal.jpg,https://x.com/GalaxyDigital/status/902537433019019264,tweet_id:902537433019019264
CNCS,@NationalService,2017-08-28T13:28:23.000Z,False,"Reminder: to contribute to #Harvey relief *safely*,  is a trusted resource for donation & volunteer options. #HurricaneHarvey",0,30,32,0,"['#Harvey', '#HurricaneHarvey']",['@NationalVOAD'],[],https://pbs.twimg.com/profile_images/1310902279671869442/49zRqgjM_normal.jpg,https://x.com/NationalService/status/902160938807242754,tweet_id:902160938807242754
FEMA,@fema,2017-08-28T23:27:07.000Z,True,"If you were affected by #Harvey, you can apply for assistance at   https://disasterassistance.gov. This also helps connect you to other resources.",97,2.8K,1.8K,0,['#Harvey'],[],[],https://pbs.twimg.com/profile_images/875380682637234176/Fw_Rx4T-_normal.jpg,https://x.com/fema/status/902311612341739520,tweet_id:902311612341739520
GuideStar by Candid,@GuideStarUSA,2017-08-28T20:56:33.000Z,False,"#HurricaneHarvey is now a tropical storm, but rains and flooding continue. These #nonprofits are helping. http://npo.gs/2vwtkmi",2,6,6,0,"['#HurricaneHarvey', '#nonprofits']",[],[],https://pbs.twimg.com/profile_images/941676512096464897/mCDhlsZh_normal.jpg,https://x.com/GuideStarUSA/status/902273721456631813,tweet_id:902273721456631813
United Way,@UnitedWay,2017-08-28T19:57:44.000Z,False,Here's how you can help support communities and families affected by #HurricaneHarvey. http://unitedway.co/2gkoG8g,2,94,69,0,['#HurricaneHarvey'],[],[],https://pbs.twimg.com/profile_images/1807770905491156992/9hAREYnH_normal.jpg,https://x.com/UnitedWay/status/902258920848105472,tweet_id:902258920848105472
Galaxy Digital,@GalaxyDigital,2017-08-28T18:33:48.000Z,False,"""We rise by lifting others."" - Robert Ingersoll
Our hearts go out to everyone affected by the #HarveyFlood. Donate @ http://rdcrss.org/2xA7G11",0,1,1,0,['#HarveyFlood'],[],[],https://pbs.twimg.com/profile_images/1037802927430283264/Yxadwzsm_normal.jpg,https://x.com/GalaxyDigital/status/902237796840165376,tweet_id:902237796840165376
Galaxy Digital,@GalaxyDigital,2017-08-28T13:21:04.000Z,False,Just a few places you can #donate for #HurricaneHarvey disaster relief. http://bit.ly/2vAYZ5n,0,1,0,0,"['#donate', '#HurricaneHarvey']",[],[],https://pbs.twimg.com/profile_images/1037802927430283264/Yxadwzsm_normal.jpg,https://x.com/GalaxyDigital/status/902159097268764672,tweet_id:902159097268764672
U.S. Coast Guard,@USCG,2017-08-28T00:04:54.000Z,True,To report a #harvey emergency you must call numbers below or 911 for assistance. If busy keep trying. Do not report distress on social media,136,3.6K,2.2K,0,['#harvey'],[],[],https://pbs.twimg.com/profile_images/1020002746626379776/gyyjE-oT_normal.jpg,https://x.com/USCG/status/901958734724915200,tweet_id:901958734724915200
Galaxy Digital,@GalaxyDigital,2017-08-25T19:21:06.000Z,True,Please stay safe during #Harvey2017.,0,0,0,0,['#Harvey2017'],[],[],https://pbs.twimg.com/profile_images/1037802927430283264/Yxadwzsm_normal.jpg,https://x.com/GalaxyDigital/status/901162539282825217,tweet_id:901162539282825217
City of Asheville,@CityofAsheville,2017-08-24T17:12:23.000Z,False,Be part of the solution. Come to this Sept. 7 open house to learn about how you can serve on an #Asheville City board or commission #AvlNews,0,3,2,0,"['#Asheville', '#AvlNews']",[],[],https://pbs.twimg.com/profile_images/1664324473317670915/EN-qUyCX_normal.jpg,https://x.com/CityofAsheville/status/900767756970315780,tweet_id:900767756970315780
Epic Foundation,@Epic_Foundation,2017-08-23T19:29:56.000Z,False,#WednesdayWisdom,0,3,12,0,['#WednesdayWisdom'],[],[],https://pbs.twimg.com/profile_images/929088598716141568/MOVeYRuj_normal.jpg,https://x.com/Epic_Foundation/status/900439985169600513,tweet_id:900439985169600513
Shedd Aquarium,@shedd_aquarium,2017-08-23T13:50:06.000Z,False,Pack your lunch sustainably to help our waters and the animals that call them home! #AdviceForBackToSchool,2,5,8,0,['#AdviceForBackToSchool'],[],[],https://pbs.twimg.com/profile_images/1810414769138196480/KFo3q7dQ_normal.jpg,https://x.com/shedd_aquarium/status/900354464518766592,tweet_id:900354464518766592
Shedd Aquarium,@shedd_aquarium,2017-08-10T15:35:44.000Z,False,Plastic will outweigh fishes in the ocean by 2050! John Holcroft's graphic illustrates the problem. #SheddTheStraw http://boredpanda.com/todays-problems-illustrations-john-holcroft/…,1,31,28,0,['#SheddTheStraw'],[],[],https://pbs.twimg.com/profile_images/1810414769138196480/KFo3q7dQ_normal.jpg,https://x.com/shedd_aquarium/status/895670002791071744,tweet_id:895670002791071744
Galaxy Digital,@GalaxyDigital,2017-08-22T18:55:04.000Z,False,There's #NoBetterFeelingThan making a positive impact in your community. #volunteer.,0,0,1,0,"['#NoBetterFeelingThan', '#volunteer']",[],[],https://pbs.twimg.com/profile_images/1037802927430283264/Yxadwzsm_normal.jpg,https://x.com/GalaxyDigital/status/900068824657088513,tweet_id:900068824657088513
Galaxy Digital,@GalaxyDigital,2017-08-22T14:01:05.000Z,False,Follow us on Medium for fresh articles and interviews about #volunteerism and the #nonprofit sector.http://bit.ly/2vUSWMr,0,0,0,0,"['#volunteerism', '#nonprofit']",[],['\\U0001f449\\U0001f3fd'],https://pbs.twimg.com/profile_images/1037802927430283264/Yxadwzsm_normal.jpg,https://x.com/GalaxyDigital/status/899994841328889860,tweet_id:899994841328889860
Galaxy Digital,@GalaxyDigital,2017-08-21T14:50:43.000Z,False,"We'll be viewing the #SolarEclipse2017 from 1pm-3pm EST, so there may be a small delay in response time. See ya'll on the other side of the",1,0,2,0,['#SolarEclipse2017'],[],['\\U0001f31b'],https://pbs.twimg.com/profile_images/1037802927430283264/Yxadwzsm_normal.jpg,https://x.com/GalaxyDigital/status/899644942456209410,tweet_id:899644942456209410
Kidznotes,@kidz_notes,2017-08-21T10:08:17.000Z,False,"How awesome is it that  has recommended #playlists for #EclipseDay?  https://eclipse2017.nasa.gov/eclipses-and-music… ENJOY, #music lovers!!",3,42,53,0,"['#playlists', '#EclipseDay', '#music']",['@NASA'],[],https://pbs.twimg.com/profile_images/1562093681867464706/RQpaF9Hn_normal.png,https://x.com/kidz_notes/status/899573864476364800,tweet_id:899573864476364800
The Citizen Times,@asheville,2017-08-21T13:17:15.000Z,False,Who needs eclipse glasses? We've got a stash of free viewers. Come by the Citizen-Times at 14 O. Henry Ave. While supplies last. #avleclipse,0,6,4,0,['#avleclipse'],[],[],https://pbs.twimg.com/profile_images/938104202005319680/6W4BY-Xw_normal.jpg,https://x.com/asheville/status/899621419839086593,tweet_id:899621419839086593
Galaxy Digital,@GalaxyDigital,2017-08-17T18:58:37.000Z,False,It's #nationalnonprofitday and we want to sincerely thank each and every one of our customers. We couldn't do it without you.,0,0,1,0,['#nationalnonprofitday'],[],[],https://pbs.twimg.com/profile_images/1037802927430283264/Yxadwzsm_normal.jpg,https://x.com/GalaxyDigital/status/898257776173957120,tweet_id:898257776173957120
Galaxy Digital,@GalaxyDigital,2017-08-15T19:20:24.000Z,False,Awesome report by our partner @VerifiedVols.,0,0,1,0,[],[],[],https://pbs.twimg.com/profile_images/1037802927430283264/Yxadwzsm_normal.jpg,https://x.com/GalaxyDigital/status/897538484386312192,tweet_id:897538484386312192
Cassandra,@CassandraReport,2017-08-14T14:18:35.000Z,False,Brands are producing edible packaging that provides sustainable alternatives to plastic http://bit.ly/2hYcj27  ,1,1,2,0,[],"['@ecovative', '@SaltWaterBrewer']",[],https://pbs.twimg.com/profile_images/1337083963387617282/wR0Yq-PI_normal.jpg,https://x.com/CassandraReport/status/897100140711956482,tweet_id:897100140711956482
NonProfit Times,@NonProfitTimes,2017-08-15T14:05:15.000Z,False,Rejected by a major gift prospect? Some ideas on how to respond in these scenarios - http://ow.ly/kP4X30eqcif #nonprofit #fundraising,0,1,2,0,"['#nonprofit', '#fundraising']",[],[],https://pbs.twimg.com/profile_images/1694803524167651328/IFXEtAa1_normal.jpg,https://x.com/NonProfitTimes/status/897459175122497536,tweet_id:897459175122497536
GuideStar by Candid,@GuideStarUSA,2017-08-14T20:52:04.000Z,False,ICYMI: Knowing what to look for on an IRS Form 990 can help you find the right #funders. http://npo.gs/2uHVTwS,0,6,5,0,['#funders'],[],[],https://pbs.twimg.com/profile_images/941676512096464897/mCDhlsZh_normal.jpg,https://x.com/GuideStarUSA/status/897199165968707587,tweet_id:897199165968707587
The Chronicle of Philanthropy,@Philanthropy,2017-08-14T18:32:01.000Z,True,Why there is no room for jargon in your fundraising appeals http://bit.ly/2uHKqNG,0,8,8,0,[],[],[],https://pbs.twimg.com/profile_images/1291062953249308676/_o16NbO__normal.png,https://x.com/Philanthropy/status/897163919550291968,tweet_id:897163919550291968
Asheville Humane,@ashevillehumane,2017-08-14T18:06:34.000Z,False,Adorable hiking buddies for adoption!!! Thank you so much to our Hiking Hounds volunteers for dedicating their... http://fb.me/1buvWvr6z,0,3,4,0,[],[],[],https://pbs.twimg.com/profile_images/1559210913152000001/g4Gl0XDT_normal.jpg,https://x.com/ashevillehumane/status/897157514910978048,tweet_id:897157514910978048
Galaxy Digital,@GalaxyDigital,2017-08-11T18:02:32.000Z,False,"#FunFactFriday If you're currently unemployed, you're 27% more likely to be hired if you have #volunteer experience. http://bit.ly/2rvF4Ug",0,1,1,0,"['#FunFactFriday', '#volunteer']",[],[],https://pbs.twimg.com/profile_images/1037802927430283264/Yxadwzsm_normal.jpg,https://x.com/GalaxyDigital/status/896069337722662912,tweet_id:896069337722662912
Galaxy Digital,@GalaxyDigital,2017-08-10T13:34:46.000Z,False,Lupe the office pup is enjoying #NationalLazyDay. She even coordinated her outfit for the occasion.,0,0,3,0,['#NationalLazyDay'],[],[],https://pbs.twimg.com/profile_images/1037802927430283264/Yxadwzsm_normal.jpg,https://x.com/GalaxyDigital/status/895639561417740288,tweet_id:895639561417740288
Galaxy Digital,@GalaxyDigital,2017-08-09T20:32:43.000Z,False,Hey #nonprofit friends! Help us vote on our new gamified #volunteer badges! What would you like them to say?http://bit.ly/2wuB21b,0,0,1,0,"['#nonprofit', '#volunteer']",[],"['\\U0001f447', '\\U0001f447']",https://pbs.twimg.com/profile_images/1037802927430283264/Yxadwzsm_normal.jpg,https://x.com/GalaxyDigital/status/895382354457395201,tweet_id:895382354457395201
B Lab,@BCorporation,2017-08-08T22:45:06.000Z,False,. turns her tech career to #impactinvesting: @fiftyyearsvc puts $ behind tech entrepreneurs. #womenintech http://ow.ly/FT0F30efFj0,1,15,27,0,"['#impactinvesting', '#womenintech']",['@elamadej'],[],https://pbs.twimg.com/profile_images/1557061402837254147/ZDv_D34I_normal.png,https://x.com/BCorporation/status/895053282397302784,tweet_id:895053282397302784
Water.org,@Water,2017-08-07T18:00:04.000Z,True,#AGoodDayIncludes safe water to drink.,0,14,34,0,['#AGoodDayIncludes'],[],[],https://pbs.twimg.com/profile_images/778317732102017024/dZQ7twaS_normal.jpg,https://x.com/Water/status/894619163498614784,tweet_id:894619163498614784
Galaxy Digital,@GalaxyDigital,2017-08-07T15:47:42.000Z,False,#AGoodDayIncludes making a difference in your community.,0,0,0,0,['#AGoodDayIncludes'],[],[],https://pbs.twimg.com/profile_images/1037802927430283264/Yxadwzsm_normal.jpg,https://x.com/GalaxyDigital/status/894585851568463872,tweet_id:894585851568463872
The Chronicle of Philanthropy,@Philanthropy,2017-08-04T19:15:00.000Z,True,Does your nonprofit have a strong visual identity? How to kick it up a notch:  bit.ly/2v6txNI [Subscription],1,5,9,0,[],[],[],https://pbs.twimg.com/profile_images/1291062953249308676/_o16NbO__normal.png,https://x.com/Philanthropy/status/893550858020954112,tweet_id:893550858020954112
VolCtr McDowell,@VolCtrMcDowell,2017-07-27T13:43:19.000Z,False,Volunteering benefits everyone http://ow.ly/HETv30dXlNp,0,1,1,0,[],[],['\\U0001f49b'],https://pbs.twimg.com/profile_images/839860644249751557/lO4x504n_normal.jpg,https://x.com/VolCtrMcDowell/status/890568282503356417,tweet_id:890568282503356417
GuideStar by Candid,@GuideStarUSA,2017-07-27T20:47:30.000Z,False,Who exactly is Generation Z? And how will they impact the #fundraising world? Learn more: http://npo.gs/2uB0z9S,0,1,3,0,['#fundraising'],[],[],https://pbs.twimg.com/profile_images/941676512096464897/mCDhlsZh_normal.jpg,https://x.com/GuideStarUSA/status/890675032241750017,tweet_id:890675032241750017
Galaxy Digital,@GalaxyDigital,2017-07-28T22:17:15.000Z,False,We collected nearly $400 of    for 's #Back2School drive!! Proud  to equip our community's kids for their 1st day of school,0,1,0,0,['#Back2School'],['@UnitedWayABC'],"['\\U0001f392', '\\u270f\\ufe0f', '\\U0001f4d3']",https://pbs.twimg.com/profile_images/1037802927430283264/Yxadwzsm_normal.jpg,https://x.com/GalaxyDigital/status/891060006023569411,tweet_id:891060006023569411
Galaxy Digital,@GalaxyDigital,2017-07-28T13:03:10.000Z,False,"#DYK For the first time in recent history, more than 50% of children attending public schools live in poverty.",0,0,0,0,['#DYK'],[],[],https://pbs.twimg.com/profile_images/1037802927430283264/Yxadwzsm_normal.jpg,https://x.com/GalaxyDigital/status/890920568899371008,tweet_id:890920568899371008
Galaxy Digital,@GalaxyDigital,2017-07-27T13:27:48.000Z,False,You can still donate to  's School Supply Drive! Check out  http://bit.ly/1UG5o72 to see how you can get involved.,0,2,1,0,[],['@UnitedWayABC'],[],https://pbs.twimg.com/profile_images/1037802927430283264/Yxadwzsm_normal.jpg,https://x.com/GalaxyDigital/status/890564378025656321,tweet_id:890564378025656321
Galaxy Digital,@GalaxyDigital,2017-07-26T19:11:35.000Z,False,Thank you  for putting up with our shananegins and excitement over 's Back to School Supply Drive    #2000backpacks,1,0,0,0,['#2000backpacks'],"['@Target', '@UnitedWayABC']","['\\U0001f4d3', '\\u270f\\ufe0f', '\\U0001f34e']",https://pbs.twimg.com/profile_images/1037802927430283264/Yxadwzsm_normal.jpg,https://x.com/GalaxyDigital/status/890288507327041536,tweet_id:890288507327041536
Galaxy Digital,@GalaxyDigital,2017-07-26T17:41:57.000Z,False,"Dave, our Data Specialist, is pictured picking out the perfect pencil case.
""We need something with pizzazz!""  #2000backpacks #giveback",0,0,0,0,"['#2000backpacks', '#giveback']",[],['\\u2728'],https://pbs.twimg.com/profile_images/1037802927430283264/Yxadwzsm_normal.jpg,https://x.com/GalaxyDigital/status/890265949231861761,tweet_id:890265949231861761
Galaxy Digital,@GalaxyDigital,2017-07-26T15:55:45.000Z,False,"Here's Annelise, our Marketing Assistant, with a Galaxy (!!!)  backpack for  's #BackToSchool Supply Drive. #giveback",0,0,0,0,"['#BackToSchool', '#giveback']",['@UnitedWayABC'],[],https://pbs.twimg.com/profile_images/1037802927430283264/Yxadwzsm_normal.jpg,https://x.com/GalaxyDigital/status/890239222006861824,tweet_id:890239222006861824
Galaxy Digital,@GalaxyDigital,2017-07-26T14:24:22.000Z,False,Ali & Annelise find the perfect composition notebooks for  's Back to School Supply Drive. Drive ends 7/28! #2000backpacks,0,0,0,0,['#2000backpacks'],['@UnitedWayABC'],[],https://pbs.twimg.com/profile_images/1037802927430283264/Yxadwzsm_normal.jpg,https://x.com/GalaxyDigital/status/890216225300783104,tweet_id:890216225300783104
Galaxy Digital,@GalaxyDigital,2017-07-26T13:37:23.000Z,False,We're proud 2 participate in the Back to School Drive every year.Cant wait for the students to see the goodies we picked out! #2000backpacks,0,2,3,0,['#2000backpacks'],[],[],https://pbs.twimg.com/profile_images/1037802927430283264/Yxadwzsm_normal.jpg,https://x.com/GalaxyDigital/status/890204403793317888,tweet_id:890204403793317888
Galaxy Digital,@GalaxyDigital,2017-07-25T19:49:55.000Z,False,How sweet it is to #giveback! Join us &  as we stuff backpacks with school supplies for students in our community! #Back2School,0,0,3,0,"['#giveback', '#Back2School']",['@UnitedWayABC'],[],https://pbs.twimg.com/profile_images/1037802927430283264/Yxadwzsm_normal.jpg,https://x.com/GalaxyDigital/status/889935764640935936,tweet_id:889935764640935936
Galaxy Digital,@GalaxyDigital,2017-07-25T18:10:25.000Z,False,"""I had so much fun today picking out school supplies. Knowing they will go to a child in need made it even better.""#2000backpacks #giveback",0,0,3,0,"['#2000backpacks', '#giveback']",[],[],https://pbs.twimg.com/profile_images/1037802927430283264/Yxadwzsm_normal.jpg,https://x.com/GalaxyDigital/status/889910726286086144,tweet_id:889910726286086144
Galaxy Digital,@GalaxyDigital,2017-07-25T12:48:51.000Z,False,90% of teachers in low income districts spend their own money on supplies. Lets give them some relief #2000backpacks #giveback #backtoschool,0,0,1,0,"['#2000backpacks', '#giveback', '#backtoschool']",[],[],https://pbs.twimg.com/profile_images/1037802927430283264/Yxadwzsm_normal.jpg,https://x.com/GalaxyDigital/status/889829800021561348,tweet_id:889829800021561348
Galaxy Digital,@GalaxyDigital,2017-07-24T20:43:50.000Z,False,Find your local #BackToSchool supply drive! Help a child start the school year with the supplies they need and the confidence they deserve,0,0,0,0,['#BackToSchool'],[],['\\u270f\\ufe0f'],https://pbs.twimg.com/profile_images/1037802927430283264/Yxadwzsm_normal.jpg,https://x.com/GalaxyDigital/status/889586946670039040,tweet_id:889586946670039040
CNCS,@NationalService,2017-07-21T13:20:18.000Z,False,". volunteers report decreased anxiety, depression, loneliness. See how #SeniorCorpsWorks by building #HealthyVolunteers.",0,7,12,0,"['#SeniorCorpsWorks', '#HealthyVolunteers']",['@SeniorCorps'],[],https://pbs.twimg.com/profile_images/1310902279671869442/49zRqgjM_normal.jpg,https://x.com/NationalService/status/888388164435443712,tweet_id:888388164435443712
National VOAD,@NationalVOAD,2017-07-20T15:19:07.000Z,True,National VOAD members are responding in Illinois. Contact the Illinois State VOAD to see how you can help. https://x.com/chicagotribune/status/888055441053429760…,0,2,3,0,[],[],[],https://pbs.twimg.com/profile_images/476388847886954497/vXSNUL0r_normal.png,https://x.com/NationalVOAD/status/888055677222084608,tweet_id:888055677222084608
Cloud for Good,@cloud4good,2017-07-20T15:20:15.000Z,False,Want to Save Money for Your #Nonprofit? Create Multi-Use Content from :  http://bit.ly/2ucAgVX,0,1,1,0,['#Nonprofit'],['@GuideStarUSA'],[],https://pbs.twimg.com/profile_images/1542836502723534851/nOXGNEHC_normal.jpg,https://x.com/cloud4good/status/888055963709825024,tweet_id:888055963709825024
National VOAD,@NationalVOAD,2017-07-19T18:05:14.000Z,True,90 degrees outside = 109 in a vehicle. RT if you won't leave your pet in a hot car this summer. #NationalHotDogDay ,0,4,2,0,[],[],['\\u2600\\ufe0f'],https://pbs.twimg.com/profile_images/476388847886954497/vXSNUL0r_normal.png,https://x.com/NationalVOAD/status/887735093565038593,tweet_id:887735093565038593
Galaxy Digital,@GalaxyDigital,2017-07-19T17:04:11.000Z,False,Are you a nonprofit that's doing #OperationBackpack or a school supply drive? We want to feature you & publicize your effort! Send us a DM,1,0,3,0,['#OperationBackpack'],[],"['\\U0001f4dd', '\\U0001f34e']",https://pbs.twimg.com/profile_images/1037802927430283264/Yxadwzsm_normal.jpg,https://x.com/GalaxyDigital/status/887719730446028802,tweet_id:887719730446028802
givingdupage,@GivingDuPage,2017-07-19T15:53:31.000Z,False,Everyone has talents they can volunteer. How do you use your talents to help the community around you? #DoGOODDuPage #GivingDuPage,0,2,0,0,"['#DoGOODDuPage', '#GivingDuPage']",[],[],https://pbs.twimg.com/profile_images/2264055315/oqpr2f3flp4y63j3yllk_normal.gif,https://x.com/GivingDuPage/status/887701947838603264,tweet_id:887701947838603264
Galaxy Digital,@GalaxyDigital,2017-07-18T12:54:58.000Z,False,#MandelaDay https://x.com/NaeemHoosain/status/887208712175222789…,0,0,1,0,['#MandelaDay'],[],[],https://pbs.twimg.com/profile_images/1037802927430283264/Yxadwzsm_normal.jpg,https://x.com/GalaxyDigital/status/887294623571464192,tweet_id:887294623571464192
Water.org,@Water,2017-07-17T22:00:05.000Z,True,"Inspired by #NelsonMandela, we believe together, we can bring safe water and sanitation to all. #waterislife",2,20,32,0,"['#NelsonMandela', '#waterislife']",[],[],https://pbs.twimg.com/profile_images/778317732102017024/dZQ7twaS_normal.jpg,https://x.com/Water/status/887069419356262400,tweet_id:887069419356262400
Galaxy Digital,@GalaxyDigital,2017-07-14T14:52:56.000Z,False,#LifeIsMoreBeautifulWhen you're helping others.,0,0,1,0,['#LifeIsMoreBeautifulWhen'],[],[],https://pbs.twimg.com/profile_images/1037802927430283264/Yxadwzsm_normal.jpg,https://x.com/GalaxyDigital/status/885874760839831553,tweet_id:885874760839831553
Sterling Volunteers,@SterlingVols,2017-07-13T18:00:10.000Z,False,Sign up for Verified Volunteers' next free webinar that answers questions about volunteer background screening! http://bddy.me/2tQK2wP,0,1,1,0,[],[],[],https://pbs.twimg.com/profile_images/1418599438256381956/NB0JIPyg_normal.jpg,https://x.com/SterlingVols/status/885559491110068227,tweet_id:885559491110068227
The Chronicle of Philanthropy,@Philanthropy,2017-07-13T16:06:19.000Z,True,31% of donors to progressive groups say they plan to give more in 2017 than they did last year,0,12,13,0,[],[],[],https://pbs.twimg.com/profile_images/1291062953249308676/_o16NbO__normal.png,https://x.com/Philanthropy/status/885530839777464321,tweet_id:885530839777464321
Galaxy Digital,@GalaxyDigital,2017-07-12T17:05:39.000Z,True,"Summertime, while a relaxing break for some kids, can be a dangerous time for low-income children. If you need help, text Food to 877-877.",0,0,1,0,[],[],[],https://pbs.twimg.com/profile_images/1037802927430283264/Yxadwzsm_normal.jpg,https://x.com/GalaxyDigital/status/885183385399939072,tweet_id:885183385399939072
B Magazine,@BtheChangeMag,2017-07-12T16:50:10.000Z,False,From : A FREE guide on how to drive inclusion thru your supply chain. Put your purchasing power 2 work! http://ow.ly/YEDw30dzpbh,0,10,10,0,[],['@BCorporation'],[],https://pbs.twimg.com/profile_images/847887185680502784/GbTTywhM_normal.jpg,https://x.com/BtheChangeMag/status/885179490040778753,tweet_id:885179490040778753
Penguin Books UK,@PenguinUKBooks,2017-07-12T06:00:01.000Z,True,"‘Aim above morality. Be not simply good, be good for something.’

Henry David Thoreau, born #onthisday in 1817.#WednesdayWisdom",1,297,411,0,"['#onthisday', '#WednesdayWisdom']",[],[],https://pbs.twimg.com/profile_images/748834135083458560/vvjAzfPh_normal.jpg,https://x.com/PenguinUKBooks/status/885015871147606016,tweet_id:885015871147606016
Galaxy Digital,@GalaxyDigital,2017-07-11T19:35:25.000Z,True,These are very interesting stats about #GENERATIONZ that are critical for your nonprofit to know.,0,0,0,0,['#GENERATIONZ'],[],[],https://pbs.twimg.com/profile_images/1037802927430283264/Yxadwzsm_normal.jpg,https://x.com/GalaxyDigital/status/884858688489619456,tweet_id:884858688489619456
CNCS,@NationalService,2017-07-11T16:47:35.000Z,False,"Disaster response, veterans, homebound adults, substance abuse prevention all supported by these  RSVP grants. #SeniorCorpsWorks",0,2,5,0,['#SeniorCorpsWorks'],['@SeniorCorps'],[],https://pbs.twimg.com/profile_images/1310902279671869442/49zRqgjM_normal.jpg,https://x.com/NationalService/status/884816448388026370,tweet_id:884816448388026370
3BL CSRwire,@CSRwire,2017-07-10T19:05:04.000Z,False,Seventh Generation Marks Three Millionth Diaper Donation to GOOD+ Foundation Benefiting Babies in Need Across the… http://bit.ly/2u0SrAk,0,1,1,0,[],[],[],https://pbs.twimg.com/profile_images/1670998486878224386/dtHxlbLO_normal.jpg,https://x.com/CSRwire/status/884488659218513920,tweet_id:884488659218513920
United Way of the Midlands,@UWMidlands,2017-07-10T13:58:11.000Z,False,Need help w/ flood recovery?  is hosting Community Outreach Sessions to provide important info! http://s118904.instanturl.net/Columbia/Rain_07072017.jpg…,0,4,1,0,[],['@CityofColumbia'],[],https://pbs.twimg.com/profile_images/837682693454381059/j5N4GFPs_normal.jpg,https://x.com/UWMidlands/status/884411432078585857,tweet_id:884411432078585857
Galaxy Digital,@GalaxyDigital,2017-07-07T14:24:18.000Z,False,Sharing some #MotivationalQuotes about #volunteering this Friday.,0,0,0,0,"['#MotivationalQuotes', '#volunteering']",[],[],https://pbs.twimg.com/profile_images/1037802927430283264/Yxadwzsm_normal.jpg,https://x.com/GalaxyDigital/status/883330839035211776,tweet_id:883330839035211776
